{"firmware":{"active_sections":["global","all","pi5"],"forbidden_settings":["arm_freq","core_freq","force_turbo","gpu_freq","over_voltage"],"managed_overlays":[],"managed_settings":{},"preserve_stock_defaults":true,"required_model_substring":"Raspberry Pi 5"},"kernel":{"architecture":"aarch64","forbidden_command_line_tokens":["init=/bin/sh"],"required_command_line_tokens":["rootwait"],"sensitive_value_keys":["cryptkey","rd.luks.key","systemd.set_credential"]},"ownership":{"application_release_may_mutate_boot":false,"provisioner":"ansible","recovery":"physical-sd-repair-or-reimage-reprovision","setting_changes":"retained-host-maintenance-backup-and-explicit-reboot"},"paths":{"cmdline":"/proc/cmdline","cmdline_source":"/boot/firmware/cmdline.txt","config":"/boot/firmware/config.txt","model":"/proc/device-tree/model","revision":"/proc/device-tree/system/linux,revision"},"profile_id":"3a2147e380558975eb301c2af6a425919fac6be6b2312570cbb70f03032b5f31","schema":"iii.boot-profile/v1","target_class":"raspberry-pi-5-noble-arm64"}
